{
    "_links": {
        "self" : {"href": "/api/profile/v1/exampleUser/intent/text/plain/edit"},
        "ozp:iwcSelf" : {"href" : "intents.api/text/plain/edit"}
    },
    "type": "text/plain",
    "action": "edit",
    "icon": "http://example.com/edit-text-plain.png",
    "label": "Edit plain text"
}