{
    "_links": {
        "self" : {"href" : "/api/profile/v1/exampleUser/intent/application/ozp-demo-ball+json/view"},
        "ozp:iwcSelf" : {"href" : "intents.api/application/ozp-demo-ball+json/view"}
    },
    "type": "application/ozp-demo-ball+json",
    "action": "view",
    "icon": "http://example.com/view-text-plain.png",
    "label": "View a bouncing ball"
}